{
 "id": "item-wand-of-cold",
 "name": "Wand of Cold",
 "name_raw": null,
 "aliases": [],
 "system": "openfrp74",
 "category": "wand",
 "usable_by": [
  "magic-user"
 ],
 "duration_raw": null,
 "description": "An icy blast in the Fear cone's dimensions; half damage on a made save.",
 "special_notes": [],
 "related": [],
 "interpretation_records": [],
 "period_conventions": [],
 "source": {
  "work": "OpenFRP74",
  "booklet": "v2",
  "page": "p34",
  "blocks": [
   10
  ],
  "content_sha256": [
   "f745a4c271e57c806ba940c941cf2887e2835fd9fd86ac1b1f4e830da8ca6e49"
  ],
  "also": [
   {
    "booklet": "v2",
    "page": "p34",
    "blocks": [
     3
    ],
    "content_sha256": [
     "5b236c46bc15cc70e35f0dab7087c0b3a9020f9efa47efd16691a79628fb9515"
    ],
    "note": "wand/staff general rules"
   }
  ]
 },
 "extraction": {
  "date": "2026-07-17",
  "model": "claude-opus-4-8",
  "notes": null
 }
}
