{
 "id": "item-wand-of-metal-detection",
 "name": "Wand of Metal Detection",
 "name_raw": null,
 "aliases": [],
 "system": "openfrp74",
 "category": "wand",
 "usable_by": [
  "magic-user"
 ],
 "duration_raw": null,
 "description": "Grasped, it points to any large body of metal — a thousand gold pieces' worth — and hints at the kind, precious or common. 2\" radius.",
 "special_notes": [],
 "related": [],
 "interpretation_records": [],
 "period_conventions": [],
 "source": {
  "work": "OpenFRP74",
  "booklet": "v2",
  "page": "p34",
  "blocks": [
   4
  ],
  "content_sha256": [
   "5591e8ffb9937cce267b30c05ec789fabba65efd5867adfa743efac9298f40ab"
  ],
  "also": [
   {
    "booklet": "v2",
    "page": "p34",
    "blocks": [
     3
    ],
    "content_sha256": [
     "5b236c46bc15cc70e35f0dab7087c0b3a9020f9efa47efd16691a79628fb9515"
    ],
    "note": "wand/staff general rules"
   }
  ]
 },
 "extraction": {
  "date": "2026-07-17",
  "model": "claude-opus-4-8",
  "notes": null
 }
}
