{
 "id": "item-ring-djinn-summoning",
 "name": "Ring of Djinn Summoning",
 "name_raw": null,
 "aliases": [],
 "system": "openfrp74",
 "category": "ring",
 "usable_by": [
  "all"
 ],
 "duration_raw": null,
 "description": "The Djinni of the ring is the wearer's permanent servant, appearing the instant it is called.",
 "special_notes": [],
 "related": [
  "monster-djinni"
 ],
 "interpretation_records": [],
 "period_conventions": [],
 "source": {
  "work": "OpenFRP74",
  "booklet": "v2",
  "page": "p33",
  "blocks": [
   11
  ],
  "content_sha256": [
   "cf96a39b1a450cbc9ce061314640663b9b804c7809c81c545bcaf86f6625caa6"
  ],
  "also": [
   {
    "booklet": "v2",
    "page": "p33",
    "blocks": [
     4
    ],
    "content_sha256": [
     "c1134ce09cd8ab5359ca6586a5317aa071e3b16cf6a5964fbe62e0c6a78b7b4b"
    ],
    "note": "ring general rules"
   },
   {
    "booklet": "v2",
    "page": "p25",
    "blocks": [
     2
    ],
    "content_sha256": [
     "d9062c1e159821aadc39eeb15ecc4268e6048c921b28fd75c848e894b460f631"
    ],
    "note": "Rings table"
   }
  ]
 },
 "extraction": {
  "date": "2026-07-17",
  "model": "claude-opus-4-8",
  "notes": null
 }
}
