{
 "id": "item-magic-mace",
 "name": "Magic Mace",
 "name_raw": null,
 "aliases": [],
 "system": "openfrp74",
 "category": "misc-weapon",
 "usable_by": [
  "fighting-man",
  "cleric"
 ],
 "duration_raw": null,
 "description": "Mace +2: the bonus applies to hit and to damage per the miscellaneous-weapon rule.",
 "special_notes": [],
 "related": [
  "table-miscellaneous-weapons"
 ],
 "interpretation_records": [],
 "period_conventions": [],
 "source": {
  "work": "OpenFRP74",
  "booklet": "v2",
  "page": "p24",
  "blocks": [
   1
  ],
  "content_sha256": [
   "72937a1d107e08c75c5d7f5bff496eb270fca8fee0d09e7f40dffbf2b9ac9f7c"
  ],
  "also": [
   {
    "booklet": "v2",
    "page": "p31",
    "blocks": [
     2
    ],
    "content_sha256": [
     "f73b96913df0bdb9bbe24ffba57c67584a9f2515bf9f3f6ed3e0d44ea121d7f4"
    ],
    "note": "bonus rule"
   }
  ]
 },
 "extraction": {
  "date": "2026-07-17",
  "model": "claude-opus-4-8",
  "notes": null
 }
}
