{
 "id": "item-scroll-protection-magic",
 "name": "Scroll of Protection: Magic",
 "name_raw": null,
 "aliases": [],
 "system": "openfrp74",
 "category": "scroll",
 "usable_by": [
  "all"
 ],
 "duration_raw": "8 turns",
 "description": "A super anti-magic circle, 1\" radius, stopping all magical functions in or out for 8 turns; it moves with the reader.",
 "special_notes": [],
 "related": [],
 "interpretation_records": [],
 "period_conventions": [],
 "source": {
  "work": "OpenFRP74",
  "booklet": "v2",
  "page": "p33",
  "blocks": [
   3
  ],
  "content_sha256": [
   "ba23330ffcccf99326d050c151ef4839afc60f6b80a34840e483faca75505936"
  ]
 },
 "extraction": {
  "date": "2026-07-17",
  "model": "claude-opus-4-8",
  "notes": null
 }
}
