{
 "id": "item-scarab-of-protection",
 "name": "Scarab of Protection from Evil High Priests",
 "name_raw": null,
 "aliases": [],
 "system": "openfrp74",
 "category": "misc-magic",
 "usable_by": [
  "all"
 ],
 "duration_raw": null,
 "description": "A charm that swallows the Finger of Death of Evil High Priests — a dozen times, then crumbles.",
 "special_notes": [],
 "related": [
  "spell-finger-of-death"
 ],
 "interpretation_records": [],
 "period_conventions": [],
 "source": {
  "work": "OpenFRP74",
  "booklet": "v2",
  "page": "p36",
  "blocks": [
   4
  ],
  "content_sha256": [
   "67dfacd0371a2fd07dbcec72a40c1888acb7ebe6a93da5c1cb1b2a04e6170c82"
  ],
  "also": [
   {
    "booklet": "v2",
    "page": "p25",
    "blocks": [
     7
    ],
    "content_sha256": [
     "a33cb6996445520166a3068d1688cfbaa4937cfdab4112d9021ab04649496b1b"
    ],
    "note": "Miscellaneous Magic table"
   }
  ]
 },
 "extraction": {
  "date": "2026-07-17",
  "model": "claude-opus-4-8",
  "notes": null
 }
}
